{
  "$schema": "../schemas/bonus-depreciation.schema.json",
  "version": "2024.1",
  "effective_date": "2024-01-01",
  "last_updated": "2025-11-29",
  "source": "IRS Publication 946 / Tax Cuts and Jobs Act of 2017",
  "source_urls": [
    "https://www.irs.gov/pub/irs-pdf/p946.pdf",
    "https://www.irs.gov/pub/irs-pdf/i4562.pdf"
  ],
  "description": "Special depreciation allowance (bonus depreciation) phase-down schedule under TCJA",
  "phase_down_schedule": [
    {
      "placed_in_service_after": "2022-12-31",
      "placed_in_service_before": "2024-01-01",
      "rate": 0.80,
      "year": 2023
    },
    {
      "placed_in_service_after": "2023-12-31",
      "placed_in_service_before": "2025-01-01",
      "rate": 0.60,
      "year": 2024
    },
    {
      "placed_in_service_after": "2024-12-31",
      "placed_in_service_before": "2026-01-01",
      "rate": 0.40,
      "year": 2025
    },
    {
      "placed_in_service_after": "2025-12-31",
      "placed_in_service_before": "2027-01-01",
      "rate": 0.20,
      "year": 2026
    },
    {
      "placed_in_service_after": "2026-12-31",
      "rate": 0.00,
      "year": 2027,
      "notes": "Bonus depreciation expires unless legislation extends"
    }
  ],
  "eligible_property": {
    "requirements": [
      "MACRS property with recovery period of 20 years or less",
      "Computer software",
      "Water utility property",
      "Qualified film, television, live theatrical production",
      "Specified plants"
    ],
    "energy_storage": {
      "eligible": true,
      "property_class": "5-year",
      "notes": "BESS qualifies as 5-year MACRS property"
    }
  },
  "election_out": {
    "available": true,
    "description": "Taxpayer may elect out of bonus depreciation for any class of property",
    "reason": "May be beneficial if expecting higher tax rates in future years"
  },
  "interaction_with_itc": {
    "basis_reduction": true,
    "description": "If ITC is claimed, depreciable basis is reduced by 50% of ITC amount",
    "example": {
      "project_cost": 1000000,
      "itc_rate": 0.30,
      "itc_amount": 300000,
      "basis_reduction": 150000,
      "depreciable_basis": 850000
    }
  },
  "calculation_example": {
    "description": "BESS project with 30% ITC and 60% bonus depreciation (2024)",
    "project_cost": 1000000,
    "itc_rate": 0.30,
    "itc_amount": 300000,
    "basis_after_itc_reduction": 850000,
    "bonus_depreciation_rate": 0.60,
    "bonus_depreciation_amount": 510000,
    "remaining_basis": 340000,
    "year_1_macrs_on_remaining": 68000,
    "total_year_1_depreciation": 578000,
    "notes": "Remaining $340,000 depreciated over remaining 5-year MACRS schedule"
  }
}
